Title,Link
Doanh nghiệp Việt lợi gì khi 'TPP không có Mỹ' được ký?,https://kinhdoanh.vnexpress.net/tin-tuc/vi-mo/doanh-nghiep-viet-loi-gi-khi-tpp-khong-co-my-duoc-ky-3720635.html
CPTPP - Khi châu Á đi tiên phong trong thương mại tự do,https://kinhdoanh.vnexpress.net/tin-tuc/quoc-te/phan-tich/cptpp-khi-chau-a-di-tien-phong-trong-thuong-mai-tu-do-3720216.html
Việt Nam cầm hoà chủ nhà Miyazaki ở giải U16 quốc tế Nhật Bản,https://thethao.vnexpress.net/tin-tuc/bong-da-trong-nuoc/viet-nam-cam-hoa-chu-nha-miyazaki-o-giai-u16-quoc-te-nhat-ban-3720699.html
Hà Nội trưng bày phối cảnh ga tàu điện ngầm cạnh Hồ Gươm,https://vnexpress.net/photo/thoi-su/ha-noi-trung-bay-phoi-canh-ga-tau-dien-ngam-canh-ho-guom-3720675.html
"Sau 36 năm sinh con đầu, người phụ nữ 62 tuổi đẻ thường con thứ",https://giadinh.vnexpress.net/tin-tuc/to-am/sau-36-nam-sinh-con-dau-nguoi-phu-nu-62-tuoi-de-thuong-con-thu-3720685.html
Sri Lanka khuyến cáo du khách cân nhắc khi đến vùng bạo động,https://dulich.vnexpress.net/tin-tuc/quoc-te/sri-lanka-khuyen-cao-du-khach-can-nhac-khi-den-vung-bao-dong-3720313.html
Hàn Quốc tiết lộ thực đơn ông Kim Jong-un thết đãi,https://vnexpress.net/tin-tuc/the-gioi/cuoc-song-do-day/han-quoc-tiet-lo-thuc-don-ong-kim-jong-un-thet-dai-3720653.html
Cuộc đối đầu 65 năm của hai kẻ thù 'truyền kiếp' Mỹ và Triều Tiên,https://vnexpress.net/tin-tuc/the-gioi/tu-lieu/cuoc-doi-dau-65-nam-cua-hai-ke-thu-truyen-kiep-my-va-trieu-tien-3720554.html
Giá vàng trong nước giảm theo thế giới,https://kinhdoanh.vnexpress.net/tin-tuc/hang-hoa/gia-vang-trong-nuoc-giam-theo-the-gioi-3720663.html
Lovren khiêu khích Man Utd chơi tấn công,https://thethao.vnexpress.net/tin-tuc/giai-ngoai-hang-anh/lovren-khieu-khich-man-utd-choi-tan-cong-3720668.html
5 kỹ năng mềm cần phát triển trong trường đại học,https://vnexpress.net/tin-tuc/giao-duc/5-ky-nang-mem-can-phat-trien-trong-truong-dai-hoc-3720670.html
Đàn ông và nữ quyền,https://vnexpress.net/tin-tuc/goc-nhin/dan-ong-va-nu-quyen-3720424.html
Ga tàu điện ngầm cạnh hồ Gươm được thiết kế như thế nào?,https://video.vnexpress.net/tin-tuc/xa-hoi/ga-tau-dien-ngam-canh-ho-guom-duoc-thiet-ke-nhu-the-nao-3720671.html
Hà Nội lấy ý kiến nhân dân về ga tàu điện ngầm cạnh Hồ Gươm,https://vnexpress.net/tin-tuc/thoi-su/ha-noi-lay-y-kien-nhan-dan-ve-ga-tau-dien-ngam-canh-ho-guom-3720177.html
Khách Việt hoang mang vì giá ôtô biến động thất thường,https://vnexpress.net/tin-tuc/oto-xe-may/thi-truong/khach-viet-hoang-mang-vi-gia-oto-bien-dong-that-thuong-3718088.html
Tài xế ôtô húc 6 xe máy ở Sài Gòn bị bắt,https://vnexpress.net/tin-tuc/phap-luat/tai-xe-oto-huc-6-xe-may-o-sai-gon-bi-bat-3720680.html
"Ôtô ben húc hàng loạt xe máy ở Sài Gòn, nhiều người bị thương",https://vnexpress.net/tin-tuc/thoi-su/giao-thong/oto-ben-huc-hang-loat-xe-may-o-sai-gon-nhieu-nguoi-bi-thuong-3717261.html
Chủ tịch Hòa Phát: Tôi chẳng biết mình có bao nhiêu tiền,https://kinhdoanh.vnexpress.net/tin-tuc/doanh-nghiep/chu-tich-hoa-phat-toi-chang-biet-minh-co-bao-nhieu-tien-3720426.html
CEO Vietjet: Tôi bỏ những đố kỵ và danh hiệu tỷ phú ngoài phòng làm việc,https://kinhdoanh.vnexpress.net/tin-tuc/doanh-nghiep/ceo-vietjet-toi-bo-nhung-do-ky-va-danh-hieu-ty-phu-ngoai-phong-lam-viec-3720192.html
Lời mời gặp Trump gây sốc của Kim Jong-un,https://vnexpress.net/tin-tuc/the-gioi/phan-tich/loi-moi-gap-trump-gay-soc-cua-kim-jong-un-3720637.html
Trump có thể gặp Kim Jong-un vào tháng 5,https://vnexpress.net/tin-tuc/the-gioi/trump-co-the-gap-kim-jong-un-vao-thang-5-3720442.html
Trump vẫn duy trì lệnh trừng phạt Triều Tiên,https://vnexpress.net/tin-tuc/the-gioi/trump-van-duy-tri-lenh-trung-phat-trieu-tien-3720491.html
2 công trình lớn ở TP HCM sắp thông xe,https://video.vnexpress.net/tin-tuc/xa-hoi/2-cong-trinh-lon-o-tp-hcm-sap-thong-xe-3717688.html
11 nước ký Hiệp định thay thế TPP,https://kinhdoanh.vnexpress.net/tin-tuc/quoc-te/11-nuoc-ky-hiep-dinh-thay-the-tpp-3720432.html
Các dấu mốc đàm phán TPP - CPTPP,https://vnexpress.net/infographics/quoc-te/cac-dau-moc-dam-phan-tpp-cptpp-3720370.html
CPTPP - Khi châu Á đi tiên phong trong thương mại tự do,https://kinhdoanh.vnexpress.net/tin-tuc/quoc-te/phan-tich/cptpp-khi-chau-a-di-tien-phong-trong-thuong-mai-tu-do-3720216.html
CPTPP - Khi châu Á đi tiên phong trong thương mại tự do,https://kinhdoanh.vnexpress.net/tin-tuc/quoc-te/phan-tich/cptpp-khi-chau-a-di-tien-phong-trong-thuong-mai-tu-do-3720216.html
Ngày 8/3 ký kết hiệp định 'TPP không có Mỹ',https://kinhdoanh.vnexpress.net/tin-tuc/vi-mo/ngay-8-3-ky-ket-hiep-dinh-tpp-khong-co-my-3720015.html
Điểm mới nào trong hiệp định 'TPP không có Mỹ' sắp được ký,https://kinhdoanh.vnexpress.net/tin-tuc/vi-mo/diem-moi-nao-trong-hiep-dinh-tpp-khong-co-my-sap-duoc-ky-3719066.html
Đường hầm đào vàng nằm trong vườn chanh dây,https://video.vnexpress.net/tin-tuc/xa-hoi/duong-ham-dao-vang-nam-trong-vuon-chanh-day-3719915.html
Đường gập ghềnh đến bàn ký kết của CPTPP,https://kinhdoanh.vnexpress.net/tin-tuc/quoc-te/duong-gap-ghenh-den-ban-ky-ket-cua-cptpp-3720402.html
Ngày 8/3 ký kết hiệp định 'TPP không có Mỹ',https://kinhdoanh.vnexpress.net/tin-tuc/vi-mo/ngay-8-3-ky-ket-hiep-dinh-tpp-khong-co-my-3720015.html
Điểm mới nào trong hiệp định 'TPP không có Mỹ' sắp được ký,https://kinhdoanh.vnexpress.net/tin-tuc/vi-mo/diem-moi-nao-trong-hiep-dinh-tpp-khong-co-my-sap-duoc-ky-3719066.html
Khánh Ly: 'Trịnh Công Sơn không lầm khi chọn Hồng Nhung',https://giaitri.vnexpress.net/photo/lang-nhac/khanh-ly-trinh-cong-son-khong-lam-khi-chon-hong-nhung-3720512.html
Khánh Ly lặng người nhớ chồng trong sinh nhật tuổi 73,https://giaitri.vnexpress.net/tin-tuc/gioi-sao/trong-nuoc/khanh-ly-lang-nguoi-nho-chong-trong-sinh-nhat-tuoi-73-3718010.html
Khánh Ly: 'Tôi không sợ thời gian và tuổi tác',https://giaitri.vnexpress.net/tin-tuc/gioi-sao/trong-nuoc/khanh-ly-toi-khong-so-thoi-gian-va-tuoi-tac-3712641.html
Thượng úy CSGT kiện chủ tịch xã ở TP HCM vì bị nhận xét xấu,https://vnexpress.net/tin-tuc/phap-luat/thuong-uy-csgt-kien-chu-tich-xa-o-tp-hcm-vi-bi-nhan-xet-xau-3720309.html
Ban Bí thư chỉ đạo xử lý vụ Mobifone mua 95% cổ phần AVG,https://vnexpress.net/tin-tuc/thoi-su/ban-bi-thu-chi-dao-xu-ly-vu-mobifone-mua-95-co-phan-avg-3720347.html
Bắt đầu thanh tra toàn diện việc MobiFone mua 95% cổ phần AVG,https://vnexpress.net/tin-tuc/thoi-su/bat-dau-thanh-tra-toan-dien-viec-mobifone-mua-95-co-phan-avg-3463803.html
Tài xế dán băng rôn lên ôtô phản đối trạm BOT ở Quảng Ninh,https://vnexpress.net/tin-tuc/thoi-su/tai-xe-dan-bang-ron-len-oto-phan-doi-tram-bot-o-quang-ninh-3720417.html
"Giao thông qua trạm BOT ở Quảng Ninh ùn tắc, tỉnh đề nghị điều tra",https://vnexpress.net/tin-tuc/thoi-su/giao-thong-qua-tram-bot-o-quang-ninh-un-tac-tinh-de-nghi-dieu-tra-3714514.html
Khách bị đánh ở chợ Đà Lạt không yêu cầu công an giải quyết,https://video.vnexpress.net/tin-tuc/du-lich/khach-bi-danh-o-cho-da-lat-khong-yeu-cau-cong-an-giai-quyet-3720393.html
Đường lên núi 2.000 bậc ở Tràng An Cổ xây dựng trái phép thế nào,https://video.vnexpress.net/tin-tuc/xa-hoi/duong-len-nui-2-000-bac-o-trang-an-co-xay-dung-trai-phep-the-nao-3719647.html
Trang trại dưa lưới in chữ mừng ngày 8/3 ở miền Tây,https://video.vnexpress.net/tin-tuc/xa-hoi/trang-trai-dua-luoi-in-chu-mung-ngay-83-o-mien-tay-3720157.html
Hồng màu xanh lá lần đầu có trong lễ hội hoa hồng Bulgaria,https://video.vnexpress.net/tin-tuc/loi-song/hong-mau-xanh-la-lan-dau-co-trong-le-hoi-hoa-hong-bulgaria-3719848.html
Dụng cụ hút ma túy trên ôtô đâm 6 cảnh sát Bình Dương,https://video.vnexpress.net/tin-tuc/phap-luat/dung-cu-hut-ma-tuy-tren-oto-dam-6-canh-sat-binh-duong-3720081.html
Hoa nhập khẩu khổng lồ cho ngày 8/3,https://video.vnexpress.net/tin-tuc/loi-song/hoa-nhap-khau-khong-lo-cho-ngay-83-3719910.html
Những phụ nữ chèo ghe trung chuyển cá ở làng chài,https://video.vnexpress.net/tin-tuc/xa-hoi/nhung-phu-nu-cheo-ghe-trung-chuyen-ca-o-lang-chai-3719705.html
"Người dân Huế lật đá, đục hàu sữa trên phá Tam Giang",https://video.vnexpress.net/tin-tuc/xa-hoi/nguoi-dan-hue-lat-da-duc-hau-sua-tren-pha-tam-giang-3719826.html
"Xe tải hất văng ôtô 4 chỗ, đâm vào nhà dân",https://video.vnexpress.net/tin-tuc/xa-hoi/xe-tai-hat-vang-oto-4-cho-dam-vao-nha-dan-3720046.html
Cảnh sát đập tường cứu 11 người kẹt trong đám cháy ở Sài Gòn,https://video.vnexpress.net/tin-tuc/xa-hoi/canh-sat-dap-tuong-cuu-11-nguoi-ket-trong-dam-chay-o-sai-gon-3719767.html
Hà Nội trưng bày phối cảnh ga tàu điện ngầm cạnh Hồ Gươm,https://vnexpress.net/photo/thoi-su/ha-noi-trung-bay-phoi-canh-ga-tau-dien-ngam-canh-ho-guom-3720675.html
Quảng Ninh xây đường hầm 8.000 tỷ đồng dưới biển,https://vnexpress.net/tin-tuc/thoi-su/quang-ninh-xay-duong-ham-8-000-ty-dong-duoi-bien-3720423.html
"Người già, trẻ nhỏ hóa tiên nữ, đại tướng trong lễ rước ở Bắc Giang",https://vnexpress.net/photo/thoi-su/nguoi-gia-tre-nho-hoa-tien-nu-dai-tuong-trong-le-ruoc-o-bac-giang-3720404.html
Hàn Quốc tiết lộ thực đơn ông Kim Jong-un thết đãi,https://vnexpress.net/tin-tuc/the-gioi/cuoc-song-do-day/han-quoc-tiet-lo-thuc-don-ong-kim-jong-un-thet-dai-3720653.html
Cuộc đối đầu 65 năm của hai kẻ thù 'truyền kiếp' Mỹ và Triều Tiên,https://vnexpress.net/tin-tuc/the-gioi/tu-lieu/cuoc-doi-dau-65-nam-cua-hai-ke-thu-truyen-kiep-my-va-trieu-tien-3720554.html
Quan chức Trung Quốc nói người Tây Tạng coi ông Tập là 'Bồ tát sống',https://vnexpress.net/tin-tuc/the-gioi/cuoc-song-do-day/quan-chuc-trung-quoc-noi-nguoi-tay-tang-coi-ong-tap-la-bo-tat-song-3720592.html
Vết bùn trong ngày không mưa tố cáo kẻ phi tang xác hai phụ nữ,https://vnexpress.net/tin-tuc/phap-luat/ho-so-pha-an/vet-bun-trong-ngay-khong-mua-to-cao-ke-phi-tang-xac-hai-phu-nu-3720085.html
Vợ dàn cảnh cướp xe của chồng đang chờ ly hôn,https://vnexpress.net/tin-tuc/phap-luat/vo-dan-canh-cuop-xe-cua-chong-dang-cho-ly-hon-3720388.html
Tài xế ôtô tông chết hai bé gái một năm trước ở Bình Dương bị bắt,https://vnexpress.net/tin-tuc/phap-luat/tai-xe-oto-tong-chet-hai-be-gai-mot-nam-truoc-o-binh-duong-bi-bat-3720638.html
"Sao không dùng Shenzhen thay Thâm Quyến, Changzhou thay Thường Châu?",https://vnexpress.net/tin-tuc/cong-dong/y-kien-cua-toi/sao-khong-dung-shenzhen-thay-tham-quyen-changzhou-thay-thuong-chau-3720654.html
Cả nhà không ai nuốt nổi tô cháo ở chợ đêm Đà Lạt,https://vnexpress.net/tin-tuc/cong-dong/y-kien-cua-toi/ca-nha-khong-ai-nuot-noi-to-chao-o-cho-dem-da-lat-3720545.html
Mèo tên Chó nổi tiếng mạng XH được huấn luyện như thế nào?,https://vnexpress.net/tin-tuc/cong-dong/anh/meo-ten-cho-noi-tieng-mang-xh-duoc-huan-luyen-nhu-the-nao-3720227.html
Bằng Kiều xin lỗi vì mất giọng trong đêm diễn,https://giaitri.vnexpress.net/photo/lang-nhac/bang-kieu-xin-loi-vi-mat-giong-trong-dem-dien-3719938.html
Tượng Phật ngồi lớn nhất Đông Nam Á ở Bình Định,https://dulich.vnexpress.net/photo/anh-video/tuong-phat-ngoi-lon-nhat-dong-nam-a-o-binh-dinh-3720234.html
"Sài Gòn đâu chỉ có phố Tây, còn cả phố Mã Lai",https://dulich.vnexpress.net/photo/anh-video/sai-gon-dau-chi-co-pho-tay-con-ca-pho-ma-lai-3719397.html
"Hà Nội 12 tháng, hơn cả 12 mùa hoa",https://vnexpress.net/projects/ha-noi-12-thang-hon-ca-12-mua-hoa-3720087/index.html
Xiaomi Mi Mix 2 Special Edition - smartphone vỏ gốm tuyệt đẹp,https://vnexpress.net/tin-tuc/san-pham/xiaomi-mi-mix-2-special-edition-smartphone-vo-gom-tuyet-dep-3718462.html
"Tiện ích triệu đô cho phụ nữ, trẻ em tại Phú Mỹ Hưng",https://vnexpress.net/interactive/2018/tien-ich-trieu-do-cho-phu-nu-tre-em-tai-phu-my-hung-3720218
Lovren khiêu khích Man Utd chơi tấn công,https://thethao.vnexpress.net/tin-tuc/giai-ngoai-hang-anh/lovren-khieu-khich-man-utd-choi-tan-cong-3720668.html
Stevens: 'Tinh thần U23 Việt Nam sẽ làm sống lại chảo lửa Lạch Tray',https://thethao.vnexpress.net/tin-tuc/bong-da-trong-nuoc/stevens-tinh-than-u23-viet-nam-se-lam-song-lai-chao-lua-lach-tray-3720427.html
Các nhà đài đồng thuận tường thuật trực tiếp V-League 2018,https://thethao.vnexpress.net/tin-tuc/bong-da-trong-nuoc/cac-nha-dai-dong-thuan-tuong-thuat-truc-tiep-v-league-2018-3720612.html
Những thứ xa xỉ đáng giá bao nhiêu trong mắt các tỷ phú?,https://kinhdoanh.vnexpress.net/tin-tuc/quoc-te/nhung-thu-xa-xi-dang-gia-bao-nhieu-trong-mat-cac-ty-phu-3719682.html
Tỷ phú Trần Đình Long: Tôi vẫn ăn đủ 365 bữa cơm tối ở nhà,https://kinhdoanh.vnexpress.net/tin-tuc/doanh-nghiep/ty-phu-tran-dinh-long-toi-van-an-du-365-bua-com-toi-o-nha-3720444.html
Các dấu mốc đàm phán TPP - CPTPP,https://vnexpress.net/infographics/quoc-te/cac-dau-moc-dam-phan-tpp-cptpp-3720370.html
Vóc dáng 'khủng' của cậu thiếu niên cao nhất thế giới,https://suckhoe.vnexpress.net/tin-tuc/khoe-dep/dan-ong/voc-dang-khung-cua-cau-thieu-nien-cao-nhat-the-gioi-3720630.html
Cô gái có mạch máu lão hóa như bà lão 80 vẫn liều mình sinh con,https://suckhoe.vnexpress.net/tin-tuc/suc-khoe/co-gai-co-mach-mau-lao-hoa-nhu-ba-lao-80-van-lieu-minh-sinh-con-3720064.html
Bà mẹ ba con ở Hà Nội giữ dáng đẹp xinh như thời con gái,https://suckhoe.vnexpress.net/tin-tuc/khoe-dep/tham-my/ba-me-ba-con-o-ha-noi-giu-dang-dep-xinh-nhu-thoi-con-gai-3720263.html
Như Quỳnh đuối sức ở đêm tái ngộ khán giả TP HCM,https://giaitri.vnexpress.net/tin-tuc/nhac/lang-nhac/nhu-quynh-duoi-suc-o-dem-tai-ngo-khan-gia-tp-hcm-3720542.html
Tự truyện Hoàng Thùy Linh (phần 2): 'Thủy Top vực tôi dậy lúc suy sụp nhất',https://giaitri.vnexpress.net/tin-tuc/sach/lang-van/tu-truyen-hoang-thuy-linh-phan-2-thuy-top-vuc-toi-day-luc-suy-sup-nhat-3720371.html
Thiên vương Lê Minh hẹn hò tình mới,https://giaitri.vnexpress.net/tin-tuc/gioi-sao/quoc-te/thien-vuong-le-minh-hen-ho-tinh-moi-3720655.html
Ngôi đền rắn bò lổm ngổm ngay trên đầu du khách,https://dulich.vnexpress.net/tin-tuc/quoc-te/ngoi-den-ran-bo-lom-ngom-ngay-tren-dau-du-khach-3720113.html
"Hà Nội 12 tháng, hơn cả 12 mùa hoa",https://vnexpress.net/projects/ha-noi-12-thang-hon-ca-12-mua-hoa-3720087/index.html
Sri Lanka khuyến cáo du khách cân nhắc khi đến vùng bạo động,https://dulich.vnexpress.net/tin-tuc/quoc-te/sri-lanka-khuyen-cao-du-khach-can-nhac-khi-den-vung-bao-dong-3720313.html
Chàng trai trốn khỏi nhà nghỉ vì thấy dung nhan thật của bạn gái,https://giadinh.vnexpress.net/tin-tuc/to-am/chang-trai-tron-khoi-nha-nghi-vi-thay-dung-nhan-that-cua-ban-gai-3720506.html
Nghề làm vợ bé đại gia của các thôn nữ Trung Quốc,https://giadinh.vnexpress.net/tin-tuc/to-am/nghe-lam-vo-be-dai-gia-cua-cac-thon-nu-trung-quoc-3719213.html
Thảm kịch từ chuyện tình tay tư của người phụ nữ có chồng,https://giadinh.vnexpress.net/tin-tuc/to-am/tham-kich-tu-chuyen-tinh-tay-tu-cua-nguoi-phu-nu-co-chong-3720441.html
Mọi iPhone từ iOS 10 có thể bị bẻ khóa với giá 15.000 USD,https://sohoa.vnexpress.net/tin-tuc/doi-song-so/bao-mat/moi-iphone-tu-ios-10-co-the-bi-be-khoa-voi-gia-15-000-usd-3720596.html
"Đạo diễn Quang Dũng hóm hỉnh: Nếu mọi điện thoại như Galaxy S9, tôi sẽ thất nghiệp",https://sohoa.vnexpress.net/tin-tuc/doi-song-so/dao-dien-quang-dung-hom-hinh-neu-moi-dien-thoai-nhu-galaxy-s9-toi-se-that-nghiep-3720389.html
Người dùng Android trung thành hơn iOS,https://sohoa.vnexpress.net/tin-tuc/doi-song-so/nguoi-dung-android-trung-thanh-hon-ios-3720454.html
VinFast tiết lộ thêm hai mẫu ôtô cỡ nhỏ chạy xăng và điện,https://vnexpress.net/tin-tuc/oto-xe-may/vinfast-tiet-lo-them-hai-mau-oto-co-nho-chay-xang-va-dien-3720193.html
SsangYong Musso - bán tải Hàn Quốc thách thức Ford Ranger,https://vnexpress.net/tin-tuc/oto-xe-may/ssangyong-musso-ban-tai-han-quoc-thach-thuc-ford-ranger-3720041.html
Tranh nhau qua vòng xuyến - ai được đi trước?,https://vnexpress.net/tin-tuc/oto-xe-may/tu-van/tranh-nhau-qua-vong-xuyen-ai-duoc-di-truoc-3720282.html
5 kỹ năng mềm cần phát triển trong trường đại học,https://vnexpress.net/tin-tuc/giao-duc/5-ky-nang-mem-can-phat-trien-trong-truong-dai-hoc-3720670.html
Quy chuẩn chính tả sẽ có nhiều thay đổi trong sách giáo khoa mới,https://vnexpress.net/tin-tuc/giao-duc/quy-chuan-chinh-ta-se-co-nhieu-thay-doi-trong-sach-giao-khoa-moi-3720323.html
Bé gái hai tuổi thuộc 2.000 chữ Trung Quốc,https://vnexpress.net/tin-tuc/giao-duc/be-gai-hai-tuoi-thuoc-2-000-chu-trung-quoc-3720481.html
Tường băng 320 triệu USD không thể ngăn nước nhiễm xạ ở Nhật,https://vnexpress.net/tin-tuc/khoa-hoc/tuong-bang-320-trieu-usd-khong-the-ngan-nuoc-nhiem-xa-o-nhat-3720470.html
Giải mã khứu giác nhạy bén của loài chó,https://vnexpress.net/infographics/thuong-thuc/giai-ma-khuu-giac-nhay-ben-cua-loai-cho-3720609.html
Động cơ đẩy sử dụng không khí thay nhiên liệu,https://vnexpress.net/tin-tuc/khoa-hoc/dong-co-day-su-dung-khong-khi-thay-nhien-lieu-3720586.html
Tôi thấy may mắn vì ở rể khi vừa cưới,https://vnexpress.net/tin-tuc/tam-su/toi-thay-may-man-vi-o-re-khi-vua-cuoi-3720614.html
Tôi có nên chịu cảnh chung vợ hay buông tay,https://vnexpress.net/tin-tuc/tam-su/chuyen-gia-go-roi/toi-co-nen-chiu-canh-chung-vo-hay-buong-tay-3719751.html
Chồng hát với đồng nghiệp nhưng im lặng khi đi với vợ,https://vnexpress.net/tin-tuc/tam-su/chuyen-gia-go-roi/chong-hat-voi-dong-nghiep-nhung-im-lang-khi-di-voi-vo-3719408.html
Hậu trường kỹ xảo 'khó tin' trong phim bom tấn Ấn Độ,https://vnexpress.net/tin-tuc/cuoi/anh/hau-truong-ky-xao-kho-tin-trong-phim-bom-tan-an-do-3719249.html
Chị em lãnh đủ vì vui quá đà trong ngày 8/3,https://vnexpress.net/tin-tuc/cuoi/anh/chi-em-la-nh-du-vi-vui-qua-da-trong-nga-y-8-3-3720048.html
Việt Hương hóa giang hồ làm náo loạn chợ cá,https://vnexpress.net/tin-tuc/cuoi/video/vie-t-huong-ho-a-giang-ho-la-m-na-o-loa-n-cho-ca-3720142.html
Saigon’s first metro line faces further delays due to $44 million debt,https://e.vnexpress.net/news/news/saigon-s-first-metro-line-faces-further-delays-due-to-44-million-debt-3720565.html
Asia-Pacific nations sign sweeping trade deal without US,https://e.vnexpress.net/news/business/economy/asia-pacific-nations-sign-sweeping-trade-deal-without-us-3720434.html
Vietnamese province's chair punished for promoting unqualified son to key position,https://e.vnexpress.net/news/news/vietnamese-province-s-chair-punished-for-promoting-unqualified-son-to-key-position-3720433.html
"Hoàng Thùy Linh: 'Đọc tự truyện của mình, đôi khi tôi thấy xót xa'",https://ngoisao.net/tin-tuc/hau-truong/showbiz-viet/hoang-thuy-linh-doc-tu-truyen-cua-minh-doi-khi-toi-thay-xot-xa-3720376.html
Như Quỳnh được em trai chăm chút từng ly từng tý ở hậu trường,https://ngoisao.net/tin-tuc/hau-truong/showbiz-viet/nhu-quynh-duoc-em-trai-cham-chut-tung-ly-tung-ty-o-hau-truong-3720551.html
Hạ Vi bị chê về diễn xuất nhưng vẫn tiếp tục đóng phim,https://ngoisao.net/tin-tuc/hau-truong/showbiz-viet/ha-vi-bi-che-ve-dien-xuat-nhung-van-tiep-tuc-dong-phim-3720479.html
Cặp đôi 'đáng ghét nhất Hàn Quốc' bị nghi chia tay,https://ione.vnexpress.net/tin-tuc/sao/chau-a/cap-doi-dang-ghet-nhat-han-quoc-bi-nghi-chia-tay-3720539.html
Những phân cảnh 'nóng mắt' của Phạm Băng Băng trên màn ảnh,https://ione.vnexpress.net/tin-tuc/phim/chau-a/nhung-phan-canh-nong-mat-cua-pham-bang-bang-tren-man-anh-3720421.html
Dàn diễn viên ‘Như Ý Cát Tường’ ngày ấy giờ ra sao,https://ione.vnexpress.net/tin-tuc/phim/chau-a/dan-dien-vien-nhu-y-cat-tuong-ngay-ay-gio-ra-sao-3720422.html
Đường hầm đào vàng nằm trong vườn chanh dây,https://video.vnexpress.net/tin-tuc/xa-hoi/duong-ham-dao-vang-nam-trong-vuon-chanh-day-3719915.html
Đường lên núi 2.000 bậc ở Tràng An Cổ xây dựng trái phép thế nào,https://video.vnexpress.net/tin-tuc/xa-hoi/duong-len-nui-2-000-bac-o-trang-an-co-xay-dung-trai-phep-the-nao-3719647.html
Quà 8/3 của những anh chồng khiến vợ nhận mà run,https://giadinh.vnexpress.net/tin-tuc/to-am/qua-8-3-cu-a-nhung-anh-cho-ng-khie-n-vo-nhan-ma-run-3719909.html
Ban Bí thư chỉ đạo xử lý vụ Mobifone mua 95% cổ phần AVG,https://vnexpress.net/tin-tuc/thoi-su/ban-bi-thu-chi-dao-xu-ly-vu-mobifone-mua-95-co-phan-avg-3720347.html
"Sóng lớn, tàu sân bay Mỹ hủy tour tham quan",https://vnexpress.net/tin-tuc/thoi-su/song-lon-tau-san-bay-my-huy-tour-tham-quan-3720156.html
Hương Giang gây chú ý ở vòng thi bikini Hoa hậu chuyển giới,https://giaitri.vnexpress.net/tin-tuc/gioi-sao/trong-nuoc/huong-giang-gay-chu-y-o-vong-thi-bikini-hoa-hau-chuyen-gioi-3719911.html
"4.000 khán giả Hà Nội rời ghế, nhảy cùng giọng ca Modern Talking",https://giaitri.vnexpress.net/tin-tuc/nhac/lang-nhac/4-000-khan-gia-ha-noi-roi-ghe-nhay-cung-giong-ca-modern-talking-3715623.html
VinFast tiết lộ thêm hai mẫu ôtô cỡ nhỏ chạy xăng và điện,https://vnexpress.net/tin-tuc/oto-xe-may/vinfast-tiet-lo-them-hai-mau-oto-co-nho-chay-xang-va-dien-3720193.html
"Ghi hai bàn trong ba phút, Juventus thắng ngược Tottenham",https://thethao.vnexpress.net/tin-tuc/champions-league/ghi-hai-ban-trong-ba-phut-juventus-thang-nguoc-tottenham-3719920.html
Khu dân cư ở Hà Nội lo lắng vì khỉ hoang quấy phá,https://vnexpress.net/tin-tuc/thoi-su/khu-dan-cu-o-ha-noi-lo-lang-vi-khi-hoang-quay-pha-3719858.html
